<!ELEMENT thuvien (sach+)>
<!ELEMENT sach (title, author, year, genre)>
<!ATTLIST sach
          id ID #REQUIRED>
<!ELEMENT title (#PCDATA)>
<!ELEMENT author (#PCDATA)>
<!ELEMENT year (#PCDATA)>
<!ELEMENT genre (#PCDATA)>
